"Looking for some beautiful images. Having a really crappy week, and need some support. #depression. Post some great beauty.  Thank you.",1
"When teens feel down, there are ways they can cope with these feelings to avoid serious #depression, such as make new friends or social connections and participate in sports or school activities. Call Focus & Balance at 210-858-9980 to learn more and see how we can help.  pic.twitter.com/ydrYcTBD2r",0
"All up in my #depression feels, today... fuckkkk  pic.twitter.com/gNza4Pzn0p",1
#depression  A word that not many people understand. A word that many people fear.  A word that should be spoken about more freely. A word that shouldn't hold any shame.  A word with no jokey come backs.  DEPRESSION it's not a swear word.  It's ok not to be ok #DepressionIsReal,0
Why is my life so cruel????? #depression,1
#Depression only exists in a brain that ACCEPTS IT???? #WALLPAPER pic.twitter.com/bfLLvZRwmn,0
"when you care about someone and trying to help them, just hope they listen and keep positive thoughts. When they’re in “depressed” #depression wish I can help her. Talk with her make her smile",0
Some thoughts on #depression about a month into my latest episode ????  pic.twitter.com/P6I7bMMBFc,0
"If someone has the courage & trust to share their struggles of #depression or #suicide ideation with you, PLEASE, please be there to listen & support  them! You may be the only person with whom they've been able to open up to. It's not easy to reach out!",0
"Always here, right? I'd like to see five of my friends post this message (Not share) to show u are always there if someone needs to talk. I think I know who will. ???? #depression kills ????",1
"???????????? ???? ???????????????????????????? ???? ???????? ?? ???????????????? ???? ?????? ?????? ??????????????, ?? ???? ?????? ?????? ?????? ??????. #depression",0
Heal me???? #art #watercolor #depression  pic.twitter.com/L8QPWAbvZO,0
"#Geriatrics & #Depression: Depression affects many older adults receiving home care, but often is not properly treated.  pic.twitter.com/pusuXIK4gp",0
"Depression may carry a feeling of worthlessness in which you feel like you can't do anything. This only makes you feel worse about yourself and drags you into an even deeper state of #depression. To push back, set small daily #goals for yourself that you can accomplish for sure! pic.twitter.com/VhC03lIbpW",0
"If you’re feeling depressed know that your not alone. Know I see u, I hear u and I support you. Know that I am masters level trained therapist. Know that while it’s ok to pray it’s ok to seek Professional help too. Know that Black people men and women are not immune. #depression  pic.twitter.com/91hb9sz8se",0
My mom said she was going to take me to the hospital so I started freaking out. Threw up on the living room floor.  Not much the hospital can do for me so what’s the point of going? #depression #anxietydisorder,1
"With my #depression I find there is often a unattached feeling of despair that attaches itself to moments, the more fitting a moment the more it expands. People then think it's the sad moment that's the issue, but even without that, the depression is still there.",1
"Suffering from serious depression ????  Sucks my plans, times everything ???? #unknown #reason #depression ",1
I don't know but today is such a bad day. So much is floating around in my head and I don't wanna do anything. Just wanna lay in bed and cry over how useless and worthless I am. I hate my #depression,1
"Waiting for my ins. to kick in so I can get treated for depression. Until then, for a mere 50 cents I can feed these turtles. They make shit therapists though. They keep telling me to drown myself in their pond so I can become one of them. It’s not bad they say ???????????. #depression  pic.twitter.com/0QJRWUgAPH – at McGough Nature Park",1
Exercise is a powerful tool for dealing with #depression,0
Adulting day #1772 (1) - (thread)  Major depressive episode hit last night... #depression #DepressionIsReal pic.twitter.com/v5XIiYG8aS,0
"""AUTISM AND DEPRESSION""  ... I hate it when I get the feels... If you suffer from autism, you'll probably get this image...  #autism #depression  pic.twitter.com/rz3zmMaK9a",1
"I have never experienced more of an emotional rollercoaster like I did with my #anxiety and #depression than I did yesterday. Not since I was at least 19. The guilt I feel today for how I treated my child is immense. These disorders are no joke. I'm sorry and I love you, Bug.",1
"We would like to have a conversation on Twitter with an athletic trainer, about the effects seen on #depression and #anxiety when a person with these issues has begun training. We know you're out there! Share your experience and let us amplify it for others!",0
"Quote: “ #Stress, #anxiety and #depression are caused when we are living to please others.” Paulo Coelho  pic.twitter.com/Cy8zun5IFm",0
And I can’t do anything about it ???? #depression  pic.twitter.com/xviBD0HpaE,1
"""I used to think that the worst thing in life was to end up alone. It's not. The worst thing in life is to end up with people who make you feel alone"".  #RobinWilliams #loneliness",0
You try hard to forget the person whom you loved more than yourself.  #loneliness #brokenheart pic.twitter.com/SzLSq8MsNQ,0
"sometimes loneliness is more than just being alone in life. it's the idea of doubt, loss and emptiness. it can be having a family but yet noone to talk to about your problems.   #loneliness #selfcare #mood",0
"What I don't know is how to fight the #loneliness. Lonely at work, lonely at home. Me, my thoughts and silence. You can build a very awful depression on it, doubt it that one can build a positive and happy person from a shit like that. But one can always try, I'll. Advise welcome",1
"THIS IS #REALITY TRYING TO #DRAG ME DOWN...DEPRIVING ME OF MY PEACE AND MY SLEEP. THE MISCHIEVOUS ELF REPRESENTS THE REMINDER OF MY #LONELINESS, THE DISCOMFORT THE BOY IS EXPERIENCING REPRESENTS HOW MY PAIN IS CONSTANT AND SHARP...I DON'T EXIST TO ANYONE ON TWITTER OR ANYWHERE.????  pic.twitter.com/IrVVVMNkMO",1
If medical doctors could be trained to assess loneliness and have more places to refer their lonely patients to (other than the pharmacy for their anti-depressant) we may be able to calm the tsunami of loneliness in our country. #loneliness  pic.twitter.com/sIePoRLeRV,0
"Nowadays, people are feeling lonelier because the quality of friendships and relationships are perceived to be of lower quality than in the past. #loneliness",0
//My TL dies in the afternoons.  I've followed about six gazillion people and still get about three tweets an hour.  #Loneliness,0
"Sucks that the only place I can go to if I can’t handle #loneliness, is the one I don’t feel safe in.   And the only person I can _try_ to ask help if I need it, is the one I don’t trust.",1
"Both addictive romantic relationships and toxic friendships leave us lonely. When we are always engaged in power struggles, there is no chance for real connection. #loneliness #psychology #choosetherapy",0
I don't want to be alone right now. Please the one man who can help me deal with this. Don't make me go through this alone. I'm already so broken. #LOST #loneliness #sad,1
hate being alone man. alone in life alone in my head it just sucks #loneliness,1
Using #powerbi Key Influencer with prediction of #loneliness dataset explained by NOMIS lone parent dataset  #data4socialgood pic.twitter.com/bkxdfCUsib,0
"don't tell me to cheer up; w/no friends (i want to see), no gf, no pets, i'm prob more #alone than u are #loneliness #antinatalism",1
"i'm just a lil boat in the middle of the ocean: lost, alone, & always getting battered by forces beyond my control #antinatalism #loneliness",1
"#fridayfact 17% of older people are in contact with family, friends and neighbours less than once a week and 11% are in contact less than once a month. #loneliness  pic.twitter.com/RoNJVWr7m4",0
When you’re so unbearably lonely that you want to die. #depression #loneliness,1
"Human beings are designed for many things, but loneliness isn't one of them.?? #love #loneliness #Humanity ???????????????? pic.twitter.com/dcEHDhFTOx",0
"Loneliness can feed depression, and depression can trigger loneliness. The important thing to remember about this cycle is that small steps can help us change. Therapy can help you identify those steps. #onlinetherapy #loneliness #depression pic.twitter.com/T98xRnnlCQ",0
I feel I shud not b here #loneliness #badday pic.twitter.com/U4K4guKRus,1
2 days to our meetup.. #loneliness #supportgroup #meetup,0
"Despite the weather we are having, we shall be at the stall with hot food and drinks on Saturday. Come and say hello to the team #food #foodbank #loneliness",0
In times like this is when I wonder how it will be like to just be by myself???? #loneliness,1
"Loneliness frazzles the body, mind and soul.  Sounds muted outside of, the sound of silence...deafening.  #loneliness",0
My biggest wish is to one day have a true friend. To be accepted the way I am.  #friendship #loneliness #acceptance,1
"My dark side is also part of me. Trying to tolerate my irritation. Guess I need some #metime, but how without feeling guilty in children holiday season  #acceptance #loneliness",1
3 days left until our first meetup.. #supportgroup #meetup #loneliness,0
"My phone is now strictly for music, memes, twitter, and YouTube bcx nobody calls or texts me???? #loneliness",1
Now playing #Tomcraft - #Loneliness on Total Dance,0
"In Quebec City, family went to a chocolate store, and spent way to long in there. I wanted to leave because the girl behind the cash register was so damn beautiful. The longer I spent in there the more painful it was. #lonely #loneliness",0
Feeling kind of blue today. A good acquaintance from long back has not answered messages on any of their media platforms in a while...What happened to them? ???? #sad #loneliness #confusion pic.twitter.com/lWtx4Ucqy8,1
I Barely Tweet???? I Have No Followers???? #loneliness #lol #me,0
Loneliness is probably one of the worst feelings there is. That’s why community is such a high priority for us here at Christians Against Poverty. We want our clients to know that they’re not alone - we are on their side. #YouMatter #Loneliness,0
"Not being lonely involves so much more than just being in the company of others: a sense of community, a tribe, common values, goals, shared rituals, shared risks, the warm feeling that you are surrounded 24/7 by people who will risk their lives for you.   #loneliness",0
We are drowning in company but dying for companionship.  #loneliness #lonelinessepidemic,0
living the moment  losing focus   #mindfulness #ThoughtOfTheDay #loneliness,0
"Next to death, being alone in life is the most feared experience for any human being, regardless of their generational label. #loneliness #connectedbutalone",1
Can we stop complaining about #loneliness until we recognize that we have institutionalized self-sufficiency and pathologized human interaction?  pic.twitter.com/sCFjoC5yOw,0
Breakdown of #jointfamily systems due to economic opportunities has increased #loneliness among #seniorszn pic.twitter.com/MyLVE432ow,0
"With ageing populations at risk of #loneliness and #depression (and depression's myriad health effects so higher healthcare costs), as well as rising childcare costs, approaches like intergenerational care seem beautifully cost efficient and solve 1 problem with another problem. pic.twitter.com/QouBTSRhR6",0
Fellow #introvert : How do you deal with #loneliness ?,0
Supporting the most vulnerable members of our community who are at risk of #socialisolation and #loneliness  pic.twitter.com/4vNqE9Ss0P,0
Not everyone wants to see me happy ???? #loneliness,1
"#Researchers Working on Pill for #Loneliness... Making something for the millennials, eh? Who can stand the little smug self-satisfied snots!",0
#lonely #loneliness #imsolonely if anybody wants to talk im here,0
Why it's simple to just stop texting #loneliness #friends #Text,1
The real question is: why isn't he worth the investment as a long-term romantic partner? #depression #anxiety #loneliness,0
Look what's arrived :) 'Connect to' badges for all our lovely #socialconnectors Join us in ending #loneliness #isolation Contact charlotte@dva.org.uk to find out more:) pic.twitter.com/94Ov7UvENe,0
"Loneliness is quite common in the elderly. Isolation and inactivity may harm a loved one’s mental, physical, and emotional health. Visit them and bring them to social events such as family gatherings.   #PassionateHeartHospice #Loneliness  pic.twitter.com/lq9et0AsHq",0
Big Dog doesn't understand me. #creativity #loneliness,0
#Loneliness is my least favorite thing about life....  pic.twitter.com/JZoErLIrgZ,1
"Something I'm trying to do now - but not succeeding. Thinking of totally abandoning all my plans for Kindness Collective, Camerados, Friendly Bench etc and retreating back into my flat and never getting involved with anything again. #Abandoned #Loneliness #Friendless pic.twitter.com/OeYiaUa0WG",1
You haven't experienced #loneliness until you've reached the last cage in the frozen chamber of a 40ft trailer.,0
Winter and holidays can be challenging seasons for older adults--especially for those living alone.  Come to EPL September 5 at 6:00 PM to learn ways to deal with #loneliness. Our special guest will be Cris Hughes from AARP. #OurEuclid pic.twitter.com/rh0S4FhIm9,0
Loneliness is as bad for your health as 15 cigarettes a day. Let that sink in #sadgirlsclub #loneliness,0
Music is my refuge. I can crawl into the space between the notes and curl my back to loneliness.  #quote #music #loneliness  pic.twitter.com/an8NoNTB6r,1
It’s NORMAL to feel lonely when you don’t have a partner and you want one. #Loneliness is an emotion that signals that a need is not being met. It’s not something you get over by thinking it away or by making more friends. #emotion #attachment,0
Ke na le problem le #loneliness guys... there are way too many of us in the world to have some people find themselves lonely and alone.,1
Any NA gamers out there? I’ve got no friends here... #loneliness #fortnitepartner,0
"Just realized the last time I was someone’s type, I was donating blood... #loneliness",0
I always complain about being bored and having no one to hangout with but as soon as someone asks I say no because I’ve accepted the fact that I love my bed too much to leave it #loneliness,1
"“In utter loneliness, a writer tries to explain the inexplicable.” ?? ?? ?? ?? ?? ?? ?? ?? ?? ?? ?? ?? ?? ?? ?? ?? ?? ?? ?? ?? -?? John Steinbeck #writing #loneliness",0
Life can be so lonely sometimes. #Loneliness #depression,1
Thank you #FareedZakaria for highlighting “#Loneliness as an Epidemic”.  We humans are pack animals and not meant to live in isolation. We don’t have the speed of jaguars or the strength of gorillas but we do have social connections skills. We need each other to survive.  pic.twitter.com/FR89506MZ7,0
When you go out and try to be a part of life & end up feeling like you are less a part of it then when you started. #Loneliness  pic.twitter.com/J625NXrWDb,0
"It doesn’t help that I live on my own in a bachelor apartment the size of a storage locker. I need to find a bigger, & better apartment. #depression, #loneliness",1
"Sometimes I want to apology just to make things better.  I have nothing to apologize, very opposite of that, I deserve an apology.  But my heart smells of loneliness and desperation... #lost #loneliness",1
"In addressing loneliness, a danger that we must watch out for is indulging in the sexy new robotic industry to provide the lonely with robot companions. #loneliness  pic.twitter.com/4QafHgHhnj",0
This is why our services are so important #loneliness  pic.twitter.com/4m1znv2l7T,0
#Loneliness 150   ????????????????????????2???????????????????????????????????????????????????????   ??????????????????????????????????????????????????????????w   ????????????????????????????????????????????????????????????????????     ?????????????????????????????????????????????????   ??????????1????????????????????????,0
#Loneliness 149    ????????????????????????  ??????????????????????????????????w  ?????????????????????.......   ??????????????????????????????????????????????????????  ????????????????????????????????????  ?????????????????????????  ??????????????????????????????????????????????????????????????????????????????   ???????????????????????????  pic.twitter.com/Q2vTLYkGYm,0
#Loneliness 148  ??????????????????????   ??????????????????????????????????????????ww  ?????????w   ?????????????????????????????????????????????????????????   ?????????????????????????????????????????????????????   ???????????????????????????????????????,0
#Loneliness 147  ??????????????????????????????????????? ??????????????????????????????????????????????????????????????????????????????????????????????????????????????????  ?????????????????????????????????????????????????   ???????????????????????????????????????????????????????????????????   ?????????????????????????.......,0
#Loneliness 146    ?????????????????????????????????????????????????????????  ????????????????????????????????????????????????????????????????????????????????????????????? ??????????????????????????????????????????????????? ???????????????????????????????????   ????????????????????????????????????????????.......,0
#Loneliness 145  ????????????????????????????????????????  ???????????????????????????????????  ???????????????????????????????????????????????????????????????????????????????????????????????????????????????????????????????????????????????  ??????????????????????????????????????????????????????  ?????????????????????????????????????????????????????????????????????????????????,0
#Loneliness 144   ????????????????????   ????????????1??????????????????????????????????2???????????????????????????????????????????  ???????????????????????????????????????????????????????????????.......   ??????????????????????????? ??????????????????????????????????????????????????  ????????????????????????????????  ???????????????.......,0
#Loneliness 143  ???????????????????????????????????????????????????????????????  ??????.......   ????????????????????????????????????ww   ????????????????????????   ??????????????????????????????????????????????????????????????????????????????????????????????w  ?????????.......   (??????????????????????????????????????????)  pic.twitter.com/mJzsZjI4AY,0
#Loneliness 142  ???????????????????   ???????????????????????????????????   ??????????????????????????????????????????????????ww????????????????????????????   ????????????????????????????????????????????? ?????????????????????????????????   ?????????w????????????w  pic.twitter.com/2hJYbiVJnU,0
#Loneliness 141  ??????????????????????????????????????????????   ???????????????????????   ????????????????????????????????????????????   ??????????????????????????????????????????????????????????????w   ???????????????????????   ?????????????????????????????????????????????????????,0
#Loneliness 140  ?????????????????????????????????????????????????????????????????????????????????????  ?????????????????????????? ?????????w   ???????????????????????????????????????????????????????????????????????????????????ww   ?????????w.......   ??????????????????????????????w    ????????????????????????,0
#Loneliness 139   ???????????????????????????????????????????????????????????????????????   ??????????????????????????????????????????????????????????????w   ??????????????????????????????   ????????????????????????   ??????????????????????????????????????   ???????????????????????????????????????????  ????????????????????????,0
#Loneliness 138    ?????????????????????????????????????????????????????????????????????????????????????????????????2????????????????????????   ????????????.......   ????????????????????????2??????????????????????????????????   ????????????????????????????????????????????????????   ??????.......   ????????????????????,0
#Loneliness 137.5  ?????????????????????????????????????????????????????????????????????????????????   ?????????????????????w??????????????????????????   ??????????????????????????????????????   ???????????????w??????????????????w  ?????????????????????????????w   ??????????????????????????   ????????????????????w  pic.twitter.com/tAiKEuhgZ3,0
#Loneliness 137  ???????????????????????????????????????????????????????????w   ????????????????????????????????????????????????ww   ???????????????????????????????????????????????????????????   ???????????????????????????????????????????????????????????????w   ???????????????????????   ??????????????????w,0
#Loneliness 136  ???????????????2?????????????????????????????....  ?????????????????????????????  ????????????????????????????????????  ???????????????????????????????????????????????????????????????????????????????????????????????????????????????????????????????????????????????????????????   ???????????????.......  pic.twitter.com/4zVyJpDKc3,0
#Loneliness 135   ?????????   ?????????????????2??????  ?????????????????????????????????????   ?????????????????????????????????????????????????????????????????????????????   ?????????????????????2?????????????????????????????????????????????????????????????????????????????????,0
#Loneliness 134   ????????????????????????????????????????????????????????????????????????????????   ????????????????????????.......   ???????????????????????????????????????????   ????????????????????????   ?????????????????????????????????????   ????????????.......  ???????????????????????????????????????????????????.......,0
#Loneliness 133    ?????????????????????2??????????????????????????????????????????????????????????????   ??????????????????? ??????????  ???????????????2???????????????????????   ????????????????????????????????????????????????w   ???????????????????????????????.......   ???????????????????????????????????????  ?????????.......  pic.twitter.com/k1dJsD31gy,0
#Loneliness 132    ????????????????????????????????????????????????????????????????????  ???????????????   ????????????????????????   ??????????w????????????????????????????????????    ???????????????.......   ????????????????????????????????????.......  ???????????????2??????????????????????????  pic.twitter.com/RdzmWejXLZ,0
#Loneliness 131  ????????????????????????????????????????  ??????????????????????????????????????????????????????????????  ??????????????????????????????????????????????????????????????.......   ??????????????????????????????????????????????????????????????.......   ????????????.......w,0
#Loneliness 130  ????????????????????????????????????????????????????????????????????????????????????????  ????????????????????????????????????????????   ????????????????????????.......????   ????????????????????????????????????????w   ??????????????????????????????????????   ???????????????????????www   ??????????????????????????????????,0
#Loneliness 129   ????????????????????????????????????   ????????????????????????????????????????????????....... ????????????????????????????????????????????????????????????????????????????????????????????????????????????????????????????????  ??????????????????????????????????????????????????????????????????.......   ?????????????????????????.......,0
#Loneliness 128  ?????????????????????????????????????  ???????????????????????   ?????????????????????????????????????????   ?????????????????????????????????????????????????????????????????????  ???( ????????????????????????? )   ???????????????????????????   ?????????????????????????????????????????????   ?????????  pic.twitter.com/iAprwpAnjK,0
#Loneliness 127  ???????????????????????????????????  ???????????????????????????????????????????????????????????????????????  ????????????????????????   ?????????????????????????????????????????????????????????????????????   ???????????   ?????????????????????????????????????w  pic.twitter.com/tTr94bGuGf,0
#Loneliness 126  ??????????????????????????????4?????????????????????????????????????????????????????????????????????   ???????.......?????????????????????????????  ????????????.......???????   ??????????????????????????????????????????w  ?????????????????????????????????????????????????????????????????????????????????ww   ??????????????????????????????????,0
#Loneliness 125   ?????????????????   ?????????????????????ww   ????????????????????????w??????????????????????????????????????????????   ????????????????????????????????????????????????????????????????????????ww   ?????????????????????????.......    ????????????????????   ??????????????????????????????????????????????w  pic.twitter.com/4EQO8kFgbo,0
#Loneliness 124  ???????????????????????  ??????????????????????????????w    ?????????   2????????????????????????   ?????????  ?????2??????????????????????????????  ????????????  ???????????????????????????????????????ww   ?????????????????????????????????????????????????ww   ???????????????????  ??????????????????????????????w  pic.twitter.com/c6NCrT1pUF,0
#Loneliness 123  ????????????????????????????????   ?????????????????????????????  ?????????????????????????????????????????????????????????????????????w   ??????????????????????????????????????????????????????????????????????????????w  ?????????????????????w   ?????????????????????? ????????  ??????????????????????????  pic.twitter.com/frGftfFjOV,0
#Loneliness 122   ???????????????????????????????????  ???????????????????????????????????????????????????????????   ???????????????????????????   ??????????????????????????????????????????????   ????????????????????????   ????????????????????????????w   ????????????????????????????????????   ???????????,0
