"they don't see me when I'm crying running a blade down my ankle, maybe then they'd think twice before they said what they said #depressed",1
Balling my eyes out because I only have 3 days left with Zachary and I work....???? #depressed,1
*sigh* ???? I haven't cried so much…I'm in so much pain… #depressed #cryin #selfhate,1
The #funniest people are often also the most #depressed. #depression,0
That moment when you get blindsided by something you wasn't expecting & now in a state of total disappointment & heartache....#depressed,1
Art hasn't tweeted lately because he lacks #socialmedia access (and also access to ropes and sharp objects). He's #depressed. #stafftweets,0
just so depressed anymore ???????? #MusicallyApp #Depressed  pic.twitter.com/rcv1I6pAk7,0
"If I could, I would stay in bed until next Monday. #depressed",1
Cant wear makeup for a while #depressed????,1
Why did I just read through my old DMs. Fml #depressed,1
Victoria secret has a sale but my wallet is dry af'???? #depressed,1
"Always thought helping others would come back when you need it most, unfortunately beginning to think otherwise... #disillusioned #depressed",0
Accept that you are #depressed and it’s not your fault. Telling yourself to ??Pull yourself together’ or ??Snap out of it’ won’t help.,0
"I was at my aunt's, all happy with my cousins and no music. My dad picks me up and he starts arguing with me now I need my music #depressed",0
Apparently you get a free pass just by mentioning #depressed #mentalDisorder #Suicidal Where was I on the free badge day??!!,0
I'm in desperate need of a good hug and a hot cup of coffee. I have no one here to hug me right now and no coffee maker at all. #Depressed,1
I am so damned sick of the near-zero degree temperatures we've had since Xmas eve. I just want to be warm again... #Depressed #IHateCold,1
idk what to do with this acc - #depressed#sad#secret_society123#love#inlove#spam4spam#follow4follow#cwd#sfs#quotes#…  pic.twitter.com/uOmcxfhKxk,0
On the way to Harris teeter I see white ducks on the way back I see dead ducks and white feathers everywhere #depressed #rip,0
Been kicked to the kerb by a big company yet again in my quest 4 a decent job #disabilitydiscrimination #depressed #upset,1
I decided to get fat over the holidays from thanksgiving to New Years. This is my last week of pigging out #depressed,1
Bloody bath.   #depressed #suicidal pic.twitter.com/FTAiXlH8zD,0
Not having a good week #depressed #pain #sleep,1
"You promised you wouldn't leave, lie or hurt me. . .  But now I'm stuck being all alone, waiting for you to need me again. . .   #depressed",1
"Guys, I have nothing to live for. I am tired of living here. Even my friends couldn't cheer me up. #tiredoflife #depressed #crying",1
What should i do with my life...so many things that i should do but so many things i dont wanna be doing #depressed,1
I'm the most #depressed person whn i am at home i guess..cuz thn u huv enough time to think abt all the nonsense!!  #IhateIt,1
I'm definitely not bringing them out in this weather to get a coffee. #depressed #deliveryplease,0
"There's a moment na I'm not happy anymore. Even if I have a bit of freedom, cars, money, gadgets, I can't help it. #depressed #exhausted",0
I guess my vacation is over... Back to work I go. #depressed ????,0
#Psychological_fact You get #depressed because you know that you're not what you should be...,0
Chris Lynn just beat my ATAR #depressed,0
Look at me now how #depressed a then a mufuckha,0
Why do people have a constant desire to talk to me? Can't y'all just leave me alone to be miserable and wallow in self loathing? #depressed,1
It's my 21st today. And about 3% people actually give a damn. #Depressed,1
"Gene Simmons, Ph.D. offers mental wellbeing to #depressed souls. #DearMentalHealthProfessionals",0
"#Anxious or #Depressed? Non-Profit Organization offers help, 24/7. 1-800-273-TALK (8255)",0
Music is just my best friend…fix everything I guess… #depressed #selfhate #music,0
Crying so much…I fuck up… he's just reading my messages… #depressed,1
Thankxxx God Mids of B.Ed Over But.....  Finals of LL.B ahead....  Starting of New Year with Examsss..... #Depressed,0
May have to cut down on the Mexican foods. #depressed #needsthatinmylife,0
Last time hanging with silken and dorian before they move to Florida #depressed #dontleave,0
staying up late because mommies not home #depressed #missingmommy ????,0
Looks like I'm getting super greenied and watching Portlandia #depressed #professionalACTtaker,0
Hammered af. And just watched the bengals lose. #depressed,0
Don't know why I feel so #depressed today. :/,1
This night went to hell…can't I ever shut up… #cryingsobad #depressed,1
I strongly believe in there if #theone for everyone. I haven't met it yet. #lost #depressed,0
"Was it the molly that made you ""like"" me? #nothingisreal #depressed",0
"All my pals shopping together, getting food, getting steaming and going to clubs while I'm slaving away on the night shift #depressed",0
"We planned for this wedding 362 days, all for Mother Nature to go and fuck everything up...thanks a bunch #depressed",0
Had to return this whip today #Depressed #neednewcar ???? pic.twitter.com/uzndmFgfXp,0
"#life. Thinking, Am I where I am supposed to be?  If yes why do I feel so #Lonely and #Depressed?",0
After marathoning Chuck on Netflix I've finally finished it and now I'm depressed. Damn you #ZacharyLevi !!! #depressed #WhatDoIDoNow?,0
If Only he loved Enuff to make me feel happy #Unhappy #Depressed,0
Damn I don't wanna go to work. :( #depressed lmao,0
Operation hang out at the Cleveland airport today. #nowyoucangobackhome #depressed,0
Is it possible that universal justice & equality are simply un-realizable under the current regime? Is there no hope?? #Depressed #TamirRice,0
I finished Game of Thrones last night.....what am I gonna do with my life until April ? #depressed,0
I guess I hurt everyone…I guess I'm just fucking liar…i can't take it anymore… #depressed,1
"Watching the Victoria secret fashion show was an error, never want to eat again #depressed #bodiestodiefor",0
I hate my life…it never going get better…depression is hell…I feel no one understand me…I only understand myself… #depressed,1
Why don't people listen? #depressed #sucksass #ineedtomanup,1
Honestly I wish I could be chilling with my bro right now.. ???????? #depressed,0
These overwhelming emotions are too much #depressed #crying #pcos,1
Here he is again #rivalformyhumansaffections can't bear him and he's stolen my sofa #depressed  pic.twitter.com/d7Goi5D2pZ,0
My friend…knows how to make me feel happy…he's so kind… #depressed #feelinglittlebetter,0
I've been impressed by Karanka at Middlesbrough. Of course we'll stick with Martinez until he decides to leave. Becoming #depressed,0
"Well, the good thing is that I don't cut myself anymore tho. #depressed",0
"Squad of donkeys, managed by an idiot, owned by a C***. Down + Out before we get to 2016 #Avfc #Depressed",0
Wait. Dont you think that the scarves are actually teaser? #depressed #TeamWINNER,0
No matter how much you tell yourself that you've accepted relegation it takes a day like today to prove that you haven't #avfc #depressed,0
#Depressed brains have some of the most tiring dreams. Maybe because they're some of the most vivid?,0
Achieved none of things I'd planned to do over holiday period. Can't get motivated & to be honest don't see the point. #exhausted #depressed,1
Weighing myself after the holidays was a terrible idea #depressed,1
????When your days are grey and he gets the best of you.....even when you don't want to. ????#Attachment #Depressed #Unfair,1
2AM where do i begin? crying off my face again. #depressed,1
What does murmuring and complaining do to our psyche? #depressed   Start thinking of what you have and say thanks you alive,0
I wish the best to those dealing w/ an internal struggle like mine. I know how hard it can hit at times.Depression hurts. #autism #depressed,1
I'm not doing so good…????…I keep overthinking… #depressed #crying #selfhate pic.twitter.com/EHOToC0XWD,1
"fuck no, rita died. I don't even wanna finish dexter #depressed",0
I feel so fucking alone tonight I just don't even care about living right now. #seasonalaffectivedisorder #depressed,1
How many times I went through Hell? I can't remember ???????? cause I've been there to many times #Depressed #WhatILearnedIn2015,1
If I don't say goodbye that means you'll see me again maybe not right away but we'll meet again #Depressed #WhatILearnedIn2015,0
Laying in bed listening to Christmas music... #christmasdontgo #depressed,0
