#Loneliness 121   ?????????????????????????????????????????????????????????????????????????? ??????????????   ???????????????.......   ??????????????????....... ????????????.......  ?????????????????????????????????  ?????????.......   ???????????????????????????????????????????? ??????????????????????????????????????????????,0
#Loneliness 120   ???????????????????  ??????????????????????????????????????ww  ????????????????????????????????????????????????????????????????????????????????    ?????????.......  ?????????LINE????????????LINE????????????   ??????????????????????????????????????????????????????????   ??????????  ?????.......????  pic.twitter.com/rLDG4ogYnz,0
#Loneliness 119   ?????????????   ???????????????????  ???..............??????????????  ?????????????????????????????????????????????????   ???????????????????????????????   ???????????????????????????????????????????  ????????????????  pic.twitter.com/DwBKQdEl5J,0
#Loneliness 118   ????????????????????????????????????????????????????????????????????????????????????   ???????????  ?????????????????????????????w  ??????????????????????????????????????????????????????????  ??????????????????????????????????????????????????  ???????????????????????????????????.......  pic.twitter.com/ZeQ2QHgY0U,0
#Loneliness 117   ??????????????????????????????????????????????????????   ?????????????????????????????????????????????????????  ??????????????????????????????......  ?????????????????????????????????????????????????  ?????????????????????????????????????????????????????????????????????????????????????  ?????????????????????????????  pic.twitter.com/WH8Ft96AfL,0
#Loneliness 116   ?????.......   ??????????????????????????????   ????????????????????????????????   ?????????????????????????????????????????????????????????????????????????????????????????  ???????????????????????????????????????????????????????????????????????????????????  ???????????????????????????????????????????????????????????  pic.twitter.com/8lZLYcgAFG,0
#Loneliness 115    ???????????????????????????????.....   ?????????????????????????????   ??????????????????????????????    ??????   ??????????????????????????????????????   ?????????????????????????????????    ?????????.......   ???????????????????????????????????????????????????? ?????????????????????????????????????????  pic.twitter.com/5UJzYacFtj,0
#Loneliness 114  ??????????????????????????????????????????????????????????.......?????????????????????????   ?????????w??????????????????w??????????w   ??????????????????????????????????????????????????????????????????????2?????????????????????????   ?????????????????????????????????     ??????????????????????????????????????????????????????  pic.twitter.com/8JfdnOID7w,0
#Loneliness 113   ??????????????????????????????????????????????????????????????????????????????????????   ???????????????????????????????.......   ????????????????????????????????????????????????????????????????????????????????????????????   ????????????????????????????????????????????.......  ???????????????????????????????,0
#Loneliness 112    ?????????????????????    ??????????????????   ??????????????????????????????????  ????????????????????????????????????????????????????????????????????   ????????????????????????????????????????????????????????????????????????????????????????   ??????????????????????????   ???????????????????????????,0
#Loneliness 111  ????????????????????????????????????????????ww   ???????????????????w  ????????????????????????  ??????????????????????????????????????????????????????????????????????????????????????????????????????????????????????????????????????   ??????????????????????????????????????w   ???????????????ww,0
#Loneliness 110    ?????????????????????????   ???????????   ??????????????????????????????????????????   ????????    ????????????????????????w   ?????????????????????.......  ??????????????????????????????  ???????????????????????.......   ?????????????????????????????????????????,0
#Loneliness 109   ??????????????????????????????????   ??????????????????????????????????????????????????w   ?????????????????????????????   ???????????????????????????????????????????????   ?????????????????????????????????????????????????  ????????????????????????????????  pic.twitter.com/oQKuNeY8Sy,0
#Loneliness 108  ??????????????????????????????????????????????????????   ???????????? ????????????.......????????????   ??????????????????? ????????????????????   ?????????????????????????????????????????????????????????????????????????????????????????????????????????????????   ???????????  pic.twitter.com/v7HSPlUyft,0
#Loneliness 107   ???????????????????????????  ?????????????.......   ??????????????????????????   ??????????????????????????????????   ???????????????????????????????   ???????????????????????????????????????????????????????????????????????????????????????????????????????????????????   ?????????.......?????????????????,0
#Loneliness 106   ??????????????????????????????????????????????????????????????????????????????????????????????????????????????    ????????????   ???????????????????????????????????????????????????   ??????????????   ??????????????????????????????????????????   ??????.......     ????????????????????,0
#Loneliness 105    ????????????????????????????????????????????????????????????????????????????????????????????????????????????????????????????????????????????  ?????????????????????w?????????????????????w   ?????????????????????????????????????   ????????????w  ???????????  pic.twitter.com/hk5DWfjQ6P,0
#Loneliness 104  ???????????????????????????  ???????????????????????????????????????????????   ???????????????????  ?????????????????????????????????????????????????????????????   ?????????????????????ww  ???????????????????????????????????????????w   ?????????????   ??????????????????????????????????????????????????????????????????????????????,0
#Loneliness 103   ???????????????????????????????????  ??????????????????????????????????????????????????????????????????????????????????????????????????????????????????????????? ?????????????????????? ????????????????????????????????????????.......    ?????????????  ??????????????????????????????????????????????????????????????????????????????????????????  pic.twitter.com/boKg7TqAj7,0
#Loneliness 102  ???????????????????   ????????????   ???????????????w?????????w   ?????????????????????????????????????????????????????2???????????????  ????????????????????????????????????????????? ???????????????????????????????????????????????????????????????????????????   ???????????????????????????????w???????????????w  pic.twitter.com/3tH2gx1UMc,0
#Loneliness 101  ??????????????????????????????????????????????????????????????????????????????????????????????????????????????????????????   ??????????????????????????????   ????????????????????????????????????????????   ??????????????????????????????????????????????,0
The person who tries to keep everyone happy often end up feeling the loneliest???????? #quotes #loneliness #sad pic.twitter.com/bycoisYJ9A,0
"#balloon #loneliness #study  ??, ??? ?????? ?????????????.  --- ???????????? ??????? ??????? ???????:) ????????? ????????? ??????? ???????????? ??????? ???????????? pic.twitter.com/GSIrFcABIp",0
"“As social creatures we need to make social connections... nowadays we don’t band together to hunt for food. We need adequately maintained friendships to ward off #loneliness, which can lead to depression, immune system disorders, disease-causing inflammation”. #TheSleepDoctor pic.twitter.com/XPnlrQCyHH",0
"Being single is not that bad, you got time stay focus on your plans and goals, you don’t even have to deal with drama. Until 11pm hits and loneliness comes along ???? #sadniggahours #kidcudi #loneliness",1
A boo would be nice but nobody loves me ???? #loneliness #singlelife,1
Now playing #Tomcraft - #Loneliness on Forever Hits,0
????? ?? ???? ?? ?? ??? ????? ??? ??..!  #nightthoughts #loneliness,0
Staying alone .. Meditation time ... Sufian Session ... #Loneliness :),0
What are you doing if you feel lonely? #loneliness #thoughts,0
Premier League starts today???? it will definitely keep my mind off things. #loneliness #football,0
Relation and connection are not somewhere and sometimes but everywhere and always' Emerson #loneliness #healing #quote,0
WHO THE FUCK WANTS TO be my friend and talk about some random shit? I has the lonelies ???? #loneliness #friends #stonedaf pic.twitter.com/5fVLFsmCbT,1
"#alone again, #loneliness my oldest,  only friend.",1
How far a lonely person can go. #loneliness  pic.twitter.com/GbdKxgZodH,0
"I can't get the images of #hopelessness out of my mind. Everywhere was busy. It's not like there's no money around,  more like there's no will to change the status quo. #homelessness",0
"Where are you right now? At a cross-road of #life with despair & #hopelessness? Calm down! Jesus Christ knows where you are, how to get you out & how to get you back to life....Not just an empty life but a purposeful, meaningful, abundant & an eternal life! #Prayer4DUnsaved2019",0
"If you have NEVER experienced #hopelessness, you can’t pass—& shouldn’t be passing—#judgement on decisions people make out of hopelessness & utter desperation.  Trust me, I know!  #SellHope to the hopeless, they’ll buy it!",0
I’m 4 anything that’ll help but gun laws/background checks aren’t enough. We have a #hopelessness problem n this country. Until we alleviate the unnecessary suffering n this country we will continue 2 experience the consequences. Hurt ppl hurt ppl. Love & support prevents & HEALS,0
#Hopelessness How can i impress my crush if i always start acting weird when she talks to me or near me,0
One of the common misunderstandings about depression is that it's similar to feeling sad or down. Sometimes a people with hopelessness feels depression or vice versa.  #hopelessness #depressiondoctor #depression pic.twitter.com/iS5JSTQKPP,0
"Wont be watching Veronica Mars anymore. Wasnt it enough that she lost Lilly, Duncan and her own mother? Ya gotta strip her of everything? Theres got to be something uplifting in a show that makes you wanna keep watching. Makers of Veronice Mars you screwed up. BAD. #Hopelessness",0
"Join us for a chat over tea on the 26th of July, Friday at 05:00 PM to share your thoughts and inspire others on “#Hope from #Hopelessness”! Venue: Costa Rica, Bahria Phase 7 CUPSHUP - “Where communities meet, opinions are valued and stories are heard” #becausewecare pic.twitter.com/gdxq3FKZbK",0
"When I meditated and was healthy, i was much happier and contented...when I had my stroke in the 90's, less so. With my maladies and #Thyroid burnout last decade, even more less so. The #hopelessness was pervasive. Discovering this technique gave me some emotional control back...  pic.twitter.com/YS6sWOvlr3",1
??????????   i can't wait for the bridge to eventually collapse so i don't need to jump off myself. ???? #hopelessness #? pic.twitter.com/lMO6Tds2He,1
Days are really hard. Some of them are excruciating. Sometimes I can’t see the end. #Anxiety #Hopelessness #Solitude,1
"That moment when the President of a country declares that’s its God that will punish suicide bombers in the country, you know the country is in a state of emergency. #hopelessness",0
"I didn't think it was your job to fix ""Poverty"". I think that if you and #FakeMayor were to #DoYourJob there would be a lot less #Hopelessness in the neighborhoods.",0
May God restore your hope today. #followlife #hopelessness #tonbofa pic.twitter.com/jpwLKNRLMO,0
I don't know what leads more to #hopelessness and #desperation Getting invalidated or getting ignored with crying for help with #depression.,1
Today has not turned out to be a good day. #infertilitysucks #infertility #hopelessness  pic.twitter.com/jCG6EZ14Ea,1
"THE BASICS! Long ladders, nets, air mattresses which could have saved more lives were missing from the fire brigades. This is what we talk abt whn we say that WE NEED basic amenities rather than splurging money on building statues! #HOPELESSNESS #SuratFireTragedy",0
It's never too late to give up on your dreams ?? #existentialcrisis #nihilism #hopelessness,0
Hopelessness is thought to result from a negative appraisal system and interact with suicide schema and lead to suicidal behavior. #hopelessness #sadness #negative_thoughts pic.twitter.com/MwaMxzy59G,0
"#Hate is an erosion of the soul - caused by #hopelessness. People in positions of power who live a life of abundance and priviledge can use a hopeless population to reinforce their own agendas. DON'T let them use you by offering 'false hope'. ""Hope deferred makes the heart sick""  pic.twitter.com/17Aa4ABsx5",0
"Re: problems that continue to perplex us all:  Say not…“There is no silver bullet!”  (This is “being only human”, which is draining, and leads to #hopelessness)  But say…“There is no silver bullet,…YET!  (Acknowledges our divinity as well, is fulfilling, and gives us #hope)",0
"It’s a painfully hopeless life to live, with the mistake of keep trying not to hope of hoping not making more mistakes.#Hopelessness  pic.twitter.com/fUuOChsdyf",0
The Hate U Give shows hopelessness when Maverick is thrown onto the road by police without reason and is searched multiple times while his kids have to watch the police abuse their power because they can #hopelessness #theme,0
If you want to witness how fucked this society is pass by a school on a rainy day like today  #hopelessness,0
"""At the root of every #sin is a kind of #hopelessness - a hopelessness  which springs from the fear that we are nothing and nobody, that nobody  loves us and wants us, that nothing good will ever again happen to us.",0
"Where there is the “need” for #willpower, there is #hopelessness! For the strong, it is a false hope. And for the weak, it is no hope.",0
?????????? ?????? ?????????? ???????? ?? ??????  ???? ?????????? ???????? ???????? ??????   ???????? ?????? ???????? ?????? ???????? ????  ?????? ?????? ???? ???? ???????? ??????   #hopelessness,0
| #Hopelessness | Youngsters need to speak against their family when they are wrong #This_Is_Sad    ???????? ???? ?? ??? ?? ???? ?????? ??? ?????? ???? ?? ??? ?????: ?????????? ??? pic.twitter.com/9NusC7RpLi,0
The lies we believe ensnare us.  #quote #lies #hopelessness  pic.twitter.com/d1TlxzGsAg,0
Never thrive on the hopelessness of another regardless how adverse the relationship may be. Hopelessness is hell’s nuclear bomb. #hope #hoperising #hopelessness,0
"This morning, I’m resetting my world view. I can’t imagine not being able to save my child, my friend, my parent, or the stranger standing next to me from gun violence. Survivor guilt is brutal. Let us agree that modern mass shootings must stop. #hopelessness",0
What do we expect from a system where health care and education are among the most profitable commercial businesses?! #Hopelessness,0
#hopelessness is dangerous and deadly; hopeless people has nothing to loose.  #make sure children and young people are nurtured to be hopeful and see the beighter side of life.  RRM.,0
Why we loose hope in ourself When people demotivate us... #hopelessness #tryingtobecool,0
OMG! The commanding staff soon sensing the #hopelessness of the situation of the country estimated at 70 billion,0
Funny GIFs needed please!! Having a DARK BLUE day—-wondering what I got my 4 kids into after I’m dead. #hopelessness #blue,0
There’s an old saying about a place called “hell” where bad people go to after they die. The worst part about hell is not the flame ! It’s the hopelessness! And I think this’s part of hell that a person with depression really taste... the hopelessness.  #hopeless #hopelessness,0
Lost my job 3 1/2 months ago. Broke my back 2 weeks later.. bank account laughs when I need to pay bills or buy food.. #anxiety #depression #hopelessness I’ll keep fighting this up hill battle till I can’t but I need a vacation to reboot or find life!,1
"- “A” Socialist’s Esteemed Gift - when gazing from your throne at all the minions & masses below humbly & respectfully give them the gift that keeps on giving and thereto declare them equal, in every way, to one another.  #Hopelessness",0
"""Hopelessness. The children of blame are..."" from ""The 7 Habits of Highly..."" #Hopelessness  pic.twitter.com/m58kQNa0L1",0
Sometimes you just know.  #Oilers #NHL #hopelessness  pic.twitter.com/GuyYIRBjJr,0
"10:48 #inpatient  Would it be considered getting dressed if I put on a bra and jeans? I could remove the robe too... brush my hair?  Mood low, so it was a temporary elevation. I wish I could have enjoyed it.  #hopelessness #keepTalkingMH",1
"Hope is beginning to leave my body, one step at a time.  #hopelessness",1
"Some days the #hopelessness settles in the soul. The eyes don't twinkle, the lips forget to #smile and the #heart sinks.",0
A person with a broken spirit gives up............ nothing but #hopelessness keeps them up....... and suicide tells them their time is up (Proverbs 15:13),0
"I once heard that insecurities come in three types: A feeling of helplessness, a feeling of hopelessness, and a feeling of worthlessness.  #insecurity #worthlessness #hopelessness",0
"#anger, #sadness, and #hopelessness all serve very important roles in our lives. A much more important role that a positive tag line, designed in most part, to silence them, or you (e.g. “it could be worse”)!  We aren’t one size fits all.",0
No.  Poverty is without any hope of money or things that require money.#Hopelessness  pic.twitter.com/rldrBbhpv0,0
gelo.. abis baca ini.. sedih jg yaahh..   it's a very familiar sad feeling and i don't want to be this kind of mother but sometimes i can't help but feel like i'm falling into an inescapable toxic cycle..  i just.. want to cry.. ???? #patahsemangat #hopelessness  pic.twitter.com/ViQTrHoVRb,1
"Ever reach a point in your life when you realize you'll be broke in a couple years, and you just feel like IF MY BIG BREAK IS COMING, PLEASE LET IT BE NOW?  #depression #hopelessness",1
Nobody cares in real life and nobody cares here. I'm gonna stop sharing my nightmares to people who are more worried about likes than actually helping a person out. #SickNotWeak #KeepTalkingMH #Hopelessness,1
"You look tired, and a bit too quiet.... is it the silence of hopelessness ? #naaumeedi #hopelessness #silence",1
"Hopelessness and #discouragement want to take you down. Don’t let them! Let this change your life! CRITICAL SHORT READ: “#Hopelessness and Discouragement are a Curse! Give Them No Place in Your Life!”  wp.mebpavSn,eic  pic.twitter.com/p9d4WYb3JS",0
"?????????? 10 ???????? ??????????, ???????? ??????, ??????! how can I understand that shit??? why is that so fast? ???? #sadness #hopelessness",1
"Wajir county is becoming more of fucked  up crib since August 2017.  #HOPELESSNESS and nightmare   Economical shutdown,blackout,tribalism, inter-clan clashes, Impunity,staged managed Africa cinema,influx of non locals and many problems.  #WeFeelLikeToMigrate#",0
It is the first purpose of #hope to make #hopelessness bearable. Robert Brault,0
"Suicide, at 50-year peak #Capitalism #Hopelessness #IncomeGap pic.twitter.com/ORXFwCDC6G",0
Bui Bui Ah Boi dressed and acting like an uncle his eyes glued to the phone screen Sitting down at the first free seat  #hopelessness,0
Headed home from Dallas to bury my dog that we've had for 15 years... #imdying #imissmypuppy #depressed ????????????????,1
Seriously!? Abigail finds Chad in bed with Belle.. Well Chabby just sunk & I don't think they'll come back from that.. #depressed #Days,0
Getting ready for night shift tnite!! #depressed #NewYearsEve,1
So the guy I like…pretend to liked me*sigh*…hating life a lot… I feel like I'll never be happy again… #depressed #singleforever #selfhate,1
One of the most saddening disappointing moments of my life was when trix cereal stopped making their cereal into different shapes #depressed,0
365/365? Another step closer towards death. #depressed,1
No I'm not #thankful for my life. #depressed,1
"Being back in my hometown, such little time I get for myself to be #depressed as I truely am. Feel so choked by pretending I'm okay.",1
Maybe the reason I get so #depressed in February is the rebound from the #holidays,1
Going through #holidays are like going through #hell. #depressed,1
People are so thankful for their life around #newyears. I get #depressed because I don't feel anything. #truth,1
"Hope 2016 is a better year for me, 2015 wasn't good. Hope things can go right in my life. #depressed",1
2015 grand finale: Kalusha messes Phone and Laptop. #Depressed.,0
"Thought about #suicide more than once over the holidays, all I seem 2 be doin is drink #alcohol & stay in bed #depressed",1
Working New Years Eve ???????? #gymlife #work #depressed,1
I want some dick.  ???? #depressed,0
My #StarWars binge concluded with episode 3 last night. Anakin Skywalker's life is just heart breaking. ???? #depressed,0
"I am going to try and get some sleep. Not sure if i will be on tomorrow, #Depressed",1
When you make it far in a difficult Mario maker level and die. #depressed,0
Looks like it's one of those cry yourself to sleep nights... #depressed #cryingmyselftosleep,1
When you're up $80-$90 and lose it all because you just can't stop<<<<<<<< #Depressed,1
It's funny at night I hate sleeping but sleeping helps I just feel so dead now is there an explanation to this feeling? #stressed #depressed,1
came home to my parents taking down the christmas decorations. #depressed,0
I thought when your in relationships with someone they are suppose to help build you up not tear you down #depressed #fuckrelationships,1
really wanting to end my life right about now. #depression #depressed,1
"It's really so sad, these stories about shootings. Makes me feel so #depressed trying to keep my head up and not crash down again. Z",1
"Damn, ""Dear John"" is really fucking me up right now... ???????????????? #depressed lbs",0
I've just ate 5 bags of sweets. WHAT IS LIFE #depressed,1
Just realized that when I wake tomorrow #Serial episode 3 will not be under my dying xmas tree.  #literallynorfiguratively #depressed,0
"#depressed  may the sadness not pull you in the void, may you speak your mind and let your feelings show, but sometimes you are numb to joy",0
the tears will cry #depressed  the pain will tear the world may hope #hope  life may live #livefreewithoutviolence,0
That moment when you remember the Blue Bell ice cream in your freezer... After you've left Texas... ???????????????? #BlueBell #depressed,0
Him:it was a mistake dating u Me:I'm sorry I'm not good enough Him:throws rocks at me Me:takes the pain #depressed,0
Curry really can't play tonight #depressed but the rest of the Warriors got it ??????????????????????????????????,0
I guess it's because I'm not feeling well that I feel so low.  Throat is starting to flare and I can't cope with it right now. #depressed,1
"#depressed, #tired, #alone,.. Stfu You're only 15 You just started your life",1
Literally going to make 2016 the best of it cause this year was true hell #depressed ????,0
I find #NewYearsResolutions to be very useful. They give me lots of things to be #depressed about in the coming year.,0
Omg doorbell ring and I thought it was him…I hate anxiety attacks… #depressed #anxiety #selfhate,1
I don't remember the last time I've cried this much from being sick. #sick #depressed #inflorida ????????,1
It really needs to start snowing #needtoshred #depressed,1
No more scioly for the rest of the year #sad #depressed #whatalife,1
when u want bae to be bae but he caps ur relationship at fam #depressed #sad #heneedssomemilk,1
I'll just stay in bed today #depressed,1
Feeling very very lazy to pack :( I don't want to go home just yet !! #depressed #holidaysover ????,1
"I don't want to be here anymore, and nobody would care if i did go, so why am I still here? #depressedgirl #depressedteen #depressed",1
So far he stop texting me…after I said something…so hopefully he doesn't show up at my house… #depressed #scare #selfhate,1
Dan is #Depressed ????because he never #Sleeps ????????because his parents are #Christian ???????1RT= 1 minute ???? of sleep ???? for DanIsNotOnFire????????,0
I just asked this customer about her cable box and she went left field and was telling me all the issues in her life ???? #depressed,0
Officially done with greys anatomy ???????? #mylifeisover #depressed,0
You don't matter anymore- feeling down ???? #depressed ???? #wtf,0
Working on the day before new eve's day... Oh how I miss my childhood and those long christmas/new years breaks... #depressed,1
Crying once again…I have something repeating in my head over and over…I'm crying… #depressed #cryinf #selfhate,1
"#Anxious or #Depressed? Non-Profit Organization offers help, 24/7. 1-800-273-TALK (8255)",0
6 Day Cooldown on CSGO competitive only cause i kicked an AFK! Thats dumb ... #mad #depressed,0
My night was amazing and awesome than it turned to shit really quickly #depressed #worried,1
"Sleeping for 12+ hours at a time, and fantasizing about ways to kill myself. #Depressed",1
I can't sleep knowing Brittany is leaving in a couple days.. ???????? #depressed,0
When you feel like you have no friends at work anymore  #depressed #left out,1
Headaches suck after crying so much…but he finally texted me????… #depressed #cryingstop,1
I feel like he lost interest in me he doesn't text me back…crying sucks…when he saw your story on snapchat… #depressed #alone #crying,1
I don't think I wanna see #TheGoodDinosaur for awhile #depressed Disney you went to far with the feels.. and I thought Brother Bear was bad,0
My family has been using my blue oil like its water and I gave Ahmed my last blue oil #depressed,0
Why do you cut your ankle? It's easier to hide and I can't handle people finding out they'll pretend to care and hurt me again #depressed,1
